GR_isbn,GR_date,GR_title,GR_rating,GR_ratings_count,GR_reviews,GR_published,GR_1_stars,GR_2_stars,GR_3_stars,GR_4_stars,GR_5_stars,GR_pages,GR_format
9788057046998,2024-11-12 00:31:25,"Tvorím, teda som: 200 hier a cvičení na rozvoj kreatívneho potenciálu by Katarína Baranová",0.0,0.0,0.0,"January 1, 2023",0.0,0.0,0.0,0.0,0.0,,
9788025741177,2024-11-12 00:31:28,Nikde tu jsem: bojovka ulicemi nevědomí by Šimon Koudela,4.0,2.0,0.0,"January 1, 2023",0.0,0.0,1.0,0.0,1.0,,
9788024951560,2024-11-12 00:31:29,Perly v botě by Jakub Kohák,0.0,0.0,0.0,"September 1, 2023",0.0,0.0,0.0,0.0,0.0,,
9788027910014,2024-11-12 00:31:34,Kronika hříšného kněze aneb Bestie z Karlštejna by Naďa Horáková,3.67,6.0,2.0,"January 1, 2023",1.0,0.0,1.0,2.0,2.0,,
9788024292342,2024-11-12 00:31:37,Zvedá se vítr by Kateřina Surmanová,3.73,132.0,19.0,"September 1, 2023",1.0,7.0,46.0,50.0,28.0,,
9788026449997,2024-11-12 00:31:39,Ájurvéda & jóga pro ženy by Zuzana Klingrová,4.2,5.0,1.0,"November 9, 2023",0.0,0.0,1.0,2.0,2.0,,
9788076751385,2024-11-12 00:31:42,Ohniště v obýváku by Vojtech Novotny,4.0,2.0,0.0,"April 23, 2024",0.0,0.0,1.0,0.0,1.0,,
9788027904853,2024-11-12 00:31:43,Boží potměšilost by Zdeněk Řehák,2.0,1.0,0.0,"January 1, 2023",0.0,1.0,0.0,0.0,0.0,,
9788025736371,2024-11-12 00:31:49,"Hlasy a hvězdy (Mycelium, #5) by Vilma Kadlečková",4.17,378.0,36.0,"January 1, 2016",1.0,5.0,90.0,116.0,166.0,,
9788027907823,2024-11-12 00:31:52,Rozbité světy by Markéta Prášková,4.43,23.0,4.0,"February 28, 2023",0.0,0.0,2.0,9.0,12.0,,
9788027913220,2024-11-12 00:31:58,Tajemství domu v L. by Šárka Andrlová,3.19,16.0,1.0,"January 1, 2024",0.0,1.0,11.0,4.0,0.0,,
9788027139019,2024-11-12 00:32:02,Ekonomické jednohubky: Odpovědi na 50 důležitých otázek ekonomie a financí by Michal Skořepa,5.0,2.0,0.0,"March 22, 2023",0.0,0.0,0.0,0.0,2.0,,
9788027517893,2024-11-12 00:32:04,Osud a Výlety páně Broučkovy: opery Janáčkových nadějí a zklamání = Fate & The Excursions of Mr Brouček: Janáček’s operas of hope and disappointment by Jirí Zahrádka,0.0,0.0,0.0,"January 1, 2023",0.0,0.0,0.0,0.0,0.0,,
9788027518142,2024-11-12 00:32:07,Vážný román by Pavel Zajíc,4.0,2.0,0.0,"January 1, 2023",0.0,0.0,1.0,0.0,1.0,,
9788027522156,2024-11-12 00:32:11,Drak na polní cestě by Jiří Hájíček,3.95,44.0,4.0,"January 1, 2024",0.0,0.0,15.0,16.0,13.0,,
9788028003760,2024-11-12 00:32:13,What tumors teach us: Parallels in cell and human behavior by Jana Šmardová,5.0,1.0,0.0,"December 8, 2023",0.0,0.0,0.0,0.0,1.0,,
9788076912212,2024-11-12 00:32:18,Smažák od Papeže Františka by Zuzana Froňková,4.0,4.0,0.0,"November 1, 2023",0.0,1.0,0.0,1.0,2.0,,
9788020035363,2024-11-12 00:32:22,Nekončící příběh: (Historiografické) narativy vzniku Československa v proměnách času a prostoru (1918-1992/1993). by Jan Hálek,4.0,1.0,0.0,"January 1, 2024",0.0,0.0,0.0,1.0,0.0,,
9788026220497,2024-11-12 00:32:26,Nebuď p*ča aneb jak (ne)pracovat s dětmi by Tomáš Morávek,4.26,168.0,22.0,"January 1, 2023",1.0,7.0,21.0,58.0,81.0,,
9788076509245,2024-11-12 00:34:51,"O medvídkovi, co neuměl plavat, ale naučil se číst by Barbora Melíková",4.0,4.0,0.0,"January 1, 2023",0.0,1.0,0.0,1.0,2.0,,
9788024950211,2024-11-12 00:34:56,Co zpívá Sojka by Lenka Poláčková,3.8,10.0,2.0,"January 1, 2023",0.0,0.0,4.0,4.0,2.0,,
9788072279012,2024-11-12 00:35:08,Krvavý Žižkov by Simona Bohatá,3.5,10.0,2.0,"January 1, 2024",0.0,0.0,7.0,1.0,2.0,,
9788074135729,2024-11-12 00:35:20,Pište čtivě a srozumitelně: Šílení korektoři o stylistice a plain language by Dalibor Behún,5.0,6.0,2.0,"January 1, 2023",0.0,0.0,0.0,0.0,6.0,,
9788027151981,2024-11-12 00:35:26,Četi nejsou by Zdeněk Svěrák,3.5,6.0,2.0,"October 18, 2023",0.0,2.0,0.0,3.0,1.0,,
9788074754357,2024-11-12 00:35:29,"Nevěsta na útěku (Nevěsta na útěku, #1) by Alexander Stainforth",5.0,2.0,1.0,"January 20, 2023",0.0,0.0,0.0,0.0,2.0,,
9788025367025,2024-11-12 00:35:34,Je to jenom sranda by Blanka Luxová,3.7600000000000002,21.0,3.0,"April 11, 2024",2.0,1.0,3.0,9.0,6.0,,
9788080906511,2024-11-12 00:35:40,Kniha – najväčší vynález ľudstva: Ako úspešne vyrobiť a umiestniť knihu na trhu by Martin Kasarda,2.5,2.0,0.0,"November 27, 2023",0.0,1.0,1.0,0.0,0.0,,
9788025740804,2024-11-12 00:35:50,Splín arcibiskupa Kohna by Jiří Kamen,3.0,1.0,0.0,"January 1, 2023",0.0,0.0,1.0,0.0,0.0,,
9788076373983,2024-11-12 00:35:58,Přístav by Magdalena Rejžková,3.21,33.0,3.0,"September 1, 2023",0.0,7.0,15.0,8.0,3.0,,
9788090890633,2024-11-12 00:36:03,4 povídky by Lenka Poláčková,4.1,41.0,2.0,"October 14, 2023",0.0,1.0,8.0,18.0,14.0,,
9788027801862,2024-11-12 00:36:06,Chrám Azylu (Zákon azylu #3) by Lucie Lukačovičová,3.94,17.0,5.0,"May 2, 2024",0.0,0.0,5.0,8.0,4.0,,
9788024287904,2024-11-12 00:36:09,"Zapomenuté osudy, zločiny a tajemství 2. světové války by Martin Brabec",2.0,1.0,0.0,"January 1, 2023",0.0,1.0,0.0,0.0,0.0,,
9788024294094,2024-11-12 00:36:10,"Milost, pane prezidente by Josef Klíma",3.5,6.0,2.0,"November 1, 2023",1.0,0.0,2.0,1.0,2.0,,
9788027150083,2024-11-12 00:36:14,Ta z katovny by Diana Štelová,3.16,19.0,5.0,"January 1, 2023",2.0,1.0,9.0,6.0,1.0,,
9788075089502,2024-11-12 00:36:17,Pod křídly Velkého krkavce by Ondřej Pivoda,5.0,2.0,0.0,"December 1, 2023",0.0,0.0,0.0,0.0,2.0,,
9788076373853,2024-11-12 00:36:18,Ještě jeden level by Ondřej Trhoň,4.24,29.0,8.0,"May 1, 2024",0.0,0.0,5.0,12.0,12.0,,
9788024952291,2024-11-12 00:36:25,Věci mezi lidmi a byty by David Budai,3.8,5.0,1.0,"October 1, 2023",0.0,0.0,2.0,2.0,1.0,,
9788024711126,2024-11-12 00:36:28,Úklid pro klid by Kateřina Brožová,0.0,0.0,0.0,"January 1, 2024",0.0,0.0,0.0,0.0,0.0,,
9788076508934,2024-11-12 00:36:33,Sídliště Svět by Iva Kokinopulosová,4.24,17.0,5.0,"January 30, 2023",0.0,0.0,3.0,7.0,7.0,,
9788076338630,2024-11-12 00:36:39,Ohnivá stopa by Karel Cubeca,3.25,4.0,0.0,"January 1, 2023",0.0,0.0,3.0,1.0,0.0,,
9788027801930,2024-11-12 00:36:42,"Plameny války  (Legie, #10) by František Kotleta",3.95,73.0,7.0,"June 18, 2024",0.0,5.0,12.0,38.0,18.0,,
9788090907706,2024-11-12 00:36:45,Bůh je mrtev: Nic není dovoleno by Tereza Matějčková,4.0,46.0,10.0,"January 1, 2023",0.0,3.0,8.0,21.0,14.0,,
9788076617278,2024-11-12 00:36:48,Národní opruzení by Karolína Zoe Meixnerová,3.93,678.0,102.0,"May 1, 2023",9.0,34.0,152.0,281.0,202.0,,
9788076291119,2024-11-12 00:36:51,Zámek v oblacích by Jan Linhart,3.0,1.0,0.0,"January 1, 2023",0.0,0.0,1.0,0.0,0.0,,
9788075885593,2024-11-12 00:36:56,"Mudroprdy (Mudroprdy, #1) by Jakub Hussar",3.0,1.0,0.0,"November 15, 2023",0.0,0.0,1.0,0.0,0.0,,
9788076560673,2024-11-12 00:37:01,Šíp s modrým peřím: Tři příběhy z Kublova a Velízu by Oldřich Selucký,5.0,1.0,0.0,"January 1, 2023",0.0,0.0,0.0,0.0,1.0,,
9788088436096,2024-11-12 00:37:05,Dvě prázdná místa by Zuzana Holčíková,3.78,9.0,1.0,"January 1, 2023",0.0,0.0,2.0,7.0,0.0,,
9788088308881,2024-11-12 00:37:09,"Osvěta, kultura, zábava: Kulturní domy v Československu by Michaela Janečková",0.0,0.0,0.0,"January 1, 2023",0.0,0.0,0.0,0.0,0.0,,
9788027908028,2024-11-12 00:37:16,Čas madon by Naďa Horáková,2.88,8.0,3.0,"January 1, 2023",0.0,3.0,3.0,2.0,0.0,,
9788075303981,2024-11-12 00:37:19,Mé dílo vyšlo u Gallimarda a stálo 69 franků by Pavel Řezníček,4.33,3.0,0.0,"January 1, 2022",0.0,0.0,1.0,0.0,2.0,,
9788088067757,2024-11-12 00:37:24,Není nebe nad Mexikem by Michal Březina,3.5,6.0,1.0,"April 3, 2023",0.0,2.0,0.0,3.0,1.0,,
9788020722003,2024-11-12 00:37:34,Kohouti budou zpívat by Marta Veselá Jirousová,4.0,2.0,1.0,"December 1, 2023",0.0,0.0,0.0,2.0,0.0,,
9788075886217,2024-11-12 00:37:36,Čas krmení by Tomáš Sekerka,3.67,6.0,1.0,"May 20, 2024",1.0,0.0,1.0,2.0,2.0,,
9788076843233,2024-11-12 00:37:50,Mezi duší a duchem: Enneagram a křesťanská spiritualita by Michal  Petr,4.29,7.0,0.0,"July 23, 2015",0.0,0.0,1.0,3.0,3.0,,
9788024753492,2024-11-12 00:37:52,Ali a dívka ze studny by Bohumil Krejza,4.0,2.0,0.0,"January 1, 2024",0.0,0.0,0.0,2.0,0.0,,
9788076627000,2024-11-12 00:37:54,Cínový vojáček by Josef Šorm,4.0,1.0,0.0,"August 26, 2024",0.0,0.0,0.0,1.0,0.0,,
9788075582195,2024-11-12 00:37:58,Bába Bedla a dívka na hřebeni by Markéta Pilátová,4.0,4.0,0.0,"March 13, 2023",0.0,0.0,2.0,0.0,2.0,,
9788076900592,2024-11-12 00:38:06,Obsah ticha by Rudolf Jurolek,5.0,2.0,0.0,"January 1, 2023",0.0,0.0,0.0,0.0,2.0,,
9788025740811,2024-11-12 00:38:11,"Krysta (Trujkunt, #5) by Petr Sagitarius",4.11,19.0,0.0,"January 1, 2023",0.0,0.0,2.0,13.0,4.0,,
9781912697786,2024-11-12 00:38:13,The Book of Prague by Ivana Myšková,3.8,20.0,4.0,"July 13, 2023",0.0,2.0,5.0,8.0,5.0,,
9788076125636,2024-11-12 00:38:16,Danred a Onyxová cesta by Dominik Kameš,4.2,5.0,0.0,"July 1, 2023",0.0,0.0,1.0,2.0,2.0,,
9788024657103,2024-11-12 00:38:20,Praha 15. století: Konfliktní společenství by Martin Nodl,0.0,0.0,0.0,"December 1, 2023",0.0,0.0,0.0,0.0,0.0,,
9788024292465,2024-11-12 00:38:28,Holka statečná: Skutečný příběh Blanky Čílové by Daniel Polman,4.33,9.0,1.0,"September 1, 2023",0.0,0.0,1.0,4.0,4.0,,
9788090880115,2024-11-12 00:38:32,Zcela legální daňové triky 2024 by Miloslav Hnátek,2.5,2.0,1.0,"January 15, 2024",0.0,1.0,1.0,0.0,0.0,,
9788076910010,2024-11-12 00:38:34,Zoufalky aneb Rande jak cyp by Ivana Hlubinková Kožmínová,3.67,3.0,1.0,"January 30, 2023",0.0,0.0,2.0,0.0,1.0,,
9788072157143,2024-11-12 00:38:36,"V říši snů aneb Lyrika, epika a motyka Miroslava Ptáčka by Miroslav Ptáček",0.0,0.0,0.0,"January 1, 2023",0.0,0.0,0.0,0.0,0.0,,
9788027136155,2024-11-12 00:38:39,Fantastická zahrádka na balkoně by Kolektiv,5.0,3.0,1.0,"March 20, 2023",0.0,0.0,0.0,0.0,3.0,,
9788027133970,2024-11-12 00:38:45,Keltové: Druidův poklad by Veronika Válková,4.58,19.0,3.0,"April 18, 2023",0.0,0.0,2.0,4.0,13.0,,
9788074565694,2024-11-12 00:38:47,Tanec na sopce by Petr Heteša,4.33,6.0,2.0,"May 5, 2024",0.0,0.0,0.0,4.0,2.0,,
9788026451587,2024-11-12 00:38:55,Věra Mikulcová: příběh kulturistky by Věra Mikulcová,5.0,2.0,0.0,"January 1, 2024",0.0,0.0,0.0,0.0,2.0,,
9788024724737,2024-11-12 00:39:01,Kluk v kopačkách – Fotbalový kemp by Markéta Bolfová,0.0,0.0,0.0,"January 30, 2024",0.0,0.0,0.0,0.0,0.0,,
9788027907915,2024-11-12 00:39:03,Z kamene a z vápna by Martin Nesměrák,2.5,2.0,0.0,"January 1, 2023",0.0,1.0,1.0,0.0,0.0,,
9788088488293,2024-11-12 00:39:08,Káva každé půlnoci by Theresa Black,4.18,50.0,14.0,"January 1, 2023",1.0,2.0,7.0,17.0,23.0,,
9788011027704,2024-11-12 00:39:17,"Bez dechu (Projekt Alfa, #3) by Lenka Dostálová",3.78,9.0,1.0,"March 10, 2023",0.0,0.0,3.0,5.0,1.0,,
9788076509832,2024-11-12 00:39:20,"Všechno, co jsem zapomněla by Adéla Chrástecká",4.13,8.0,3.0,"January 30, 2023",0.0,1.0,0.0,4.0,3.0,,
9788000073187,2024-11-12 00:39:23,Stín železné opony by Petr Hugo Šlik,4.78,9.0,2.0,"January 1, 2024",0.0,0.0,0.0,2.0,7.0,,
9788027801985,2024-11-12 00:39:28,"Zpověď stárnoucí trosky, která má psa by Eva Michorová",2.67,3.0,0.0,"January 1, 2024",0.0,1.0,2.0,0.0,0.0,,
9788020034663,2024-11-12 00:39:30,Richard Wagner a jeho Židovství v hudbě by Pavel Sládek,4.0,1.0,0.0,"January 1, 2023",0.0,0.0,0.0,1.0,0.0,,
9788074481147,2024-11-12 00:39:32,Skutečné zločiny v Brně a okolí by Ivana Žáková,4.0,2.0,0.0,"January 1, 2024",0.0,0.0,0.0,2.0,0.0,,
9788027150380,2024-11-12 00:39:37,Malé tečky světla by Zuzana Švédová,4.67,3.0,0.0,"November 20, 2023",0.0,0.0,0.0,1.0,2.0,,
9788024289472,2024-11-12 00:39:39,Sochař by Artur Janoušek,3.3,10.0,1.0,"January 1, 2023",1.0,1.0,3.0,4.0,1.0,,
9788076833739,2024-11-12 00:39:52,Myšlenky zločince v české kotlině by Jiřina Hofmanová,3.92,13.0,2.0,"August 1, 2023",0.0,0.0,5.0,4.0,4.0,,
9788024657110,2024-11-12 00:39:54,Vyjasňování: Pět rozhovorů s Brunem Latourem by Michel Serres,4.1,136.0,7.0,"January 1, 1992",1.0,10.0,21.0,47.0,57.0,,
9788075151629,2024-11-12 00:39:56,Les by Tereza Říčanová,3.56,9.0,0.0,"August 20, 2023",0.0,0.0,6.0,1.0,2.0,,
9788076616769,2024-11-12 00:39:59,Zvonkohra by Eliška Václavíková,4.34,327.0,54.0,"February 20, 2023",1.0,12.0,39.0,97.0,178.0,,
9788076900370,2024-11-12 00:40:09,Úzkost je rozkoš I/II: …s posvátným hrncem na hlavě by Karel Šebek,5.0,2.0,0.0,"January 1, 2023",0.0,0.0,0.0,0.0,2.0,,
9788024950839,2024-11-12 00:40:12,Životní (s)milníky by Jitka Slavíková,0.0,0.0,0.0,"June 1, 2023",0.0,0.0,0.0,0.0,0.0,,
9788072225743,2024-11-12 00:40:14,Kriminální případy z Orlických hor 2 by Jiří Mach,4.0,3.0,0.0,"July 1, 2023",0.0,0.0,1.0,1.0,1.0,,
9788090856837,2024-11-12 00:40:17,Pommes frites by Jan Valík,2.0,3.0,0.0,"January 1, 2023",1.0,1.0,1.0,0.0,0.0,,
9788027514526,2024-11-12 00:40:19,Rajčaťáci a Banáni by Petr Váša,4.4,5.0,1.0,"March 24, 2023",0.0,0.0,1.0,1.0,3.0,,
9788076373235,2024-11-12 00:40:23,"Pokrok nezastavíš, čéče! by Milada Rezková",4.33,3.0,1.0,"May 1, 2023",0.0,0.0,1.0,0.0,2.0,,
9788020462602,2024-11-12 00:40:28,O kočkách a kocourech by Josef Schwarz,3.67,3.0,0.0,"November 11, 2023",0.0,0.0,1.0,2.0,0.0,,
9788088635383,2024-11-12 00:40:34,Okřídlení tvorové v bouřkových mračnech by Karin Novotná,4.45,20.0,8.0,"October 30, 2023",0.0,0.0,2.0,7.0,11.0,,
9788026511854,2024-11-12 00:40:36,Náměsíční vrazi by Stanislava Veselá,3.97,68.0,6.0,"January 1, 2023",1.0,5.0,15.0,21.0,26.0,,
9788070357743,2024-11-12 00:40:41,The Dreaming Rebel Toyen 1902-1980 by Anna Pravdova et editors,0.0,0.0,0.0,"January 1, 2021",0.0,0.0,0.0,0.0,0.0,,
9788076617254,2024-11-12 00:40:45,"Síla obsidiánu (Tajemství obsidiánu, #3) by Petra Martišková",4.0,35.0,4.0,"May 8, 2023",0.0,1.0,11.0,10.0,13.0,,
9788025369425,2024-11-12 00:40:48,Ocelová liga by Adéla Rosípalová,3.49,68.0,23.0,"August 29, 2024",3.0,5.0,25.0,26.0,9.0,,
9788074435003,2024-11-12 00:40:53,Dům U Orobinců by Ondřej Krystyník,4.55,11.0,1.0,"January 1, 2023",0.0,0.0,1.0,3.0,7.0,,
9788072815814,2024-11-12 00:40:58,Na život se nečeká by Jaroslav Dušek,4.33,6.0,2.0,"January 1, 2023",0.0,0.0,1.0,2.0,3.0,,
9788076619340,2024-11-12 00:41:01,Můžeš říct: Miluju tě by Nofreeusernames,3.84,329.0,55.0,"May 6, 2024",8.0,9.0,86.0,150.0,76.0,,
9788072444892,2024-11-12 00:41:05,Učitelka angličtiny by Magda Váňová,4.0,9.0,0.0,"February 24, 2023",0.0,0.0,3.0,3.0,3.0,,
9788074852671,2024-11-12 00:41:16,Prokletí impéria a ruská lež: Rusk a Ukrajina v kontextu a Kontextech by Kateřina Hloušková,5.0,1.0,0.0,"January 1, 2023",0.0,0.0,0.0,0.0,1.0,,
9788076111493,2024-11-12 00:41:19,MaminkOFF: Malovaly jsme si mateřství by Kateřina Chalupníková,4.22,9.0,0.0,"January 1, 2024",0.0,0.0,2.0,3.0,4.0,,
9788011035594,2024-11-12 00:41:22,Ztracenné by Michelle Losekoot,4.22,201.0,26.0,"January 1, 2023",3.0,10.0,28.0,59.0,101.0,,
9788000070292,2024-11-12 00:41:28,Vlaky by Lucie Hášová Truhelková,3.67,3.0,2.0,"March 27, 2023",0.0,0.0,1.0,2.0,0.0,,
9788024950266,2024-11-12 00:41:29,Ostrov by Rudolf Havlík,3.13,8.0,3.0,"February 1, 2023",1.0,0.0,5.0,1.0,1.0,,
9788011032326,2024-11-12 00:41:31,Drátem do oka by Štěpánka Živčáková,4.5,2.0,0.0,"January 1, 2023",0.0,0.0,0.0,1.0,1.0,,
9783991530138,2024-11-12 00:41:33,Zbynek Sekal: 100 by Zbyněk Sekal,0.0,0.0,0.0,"June 11, 2024",0.0,0.0,0.0,0.0,0.0,,
9788075885029,2024-11-12 00:41:35,"Velice dlouhé schody (Ota Fink, #9) by Jaroslav Velinský",4.33,15.0,3.0,"August 28, 2023",0.0,0.0,3.0,4.0,8.0,,
9788090573888,2024-11-12 00:41:39,Malí školáci by Zuzana Pospíšilová,1.0,2.0,1.0,"January 1, 2022",2.0,0.0,0.0,0.0,0.0,,
9788024952512,2024-11-12 00:41:42,Co tě nezabije by Aňa Geislerová,3.44,80.0,4.0,"January 1, 2023",3.0,10.0,23.0,37.0,7.0,,
9788090856820,2024-11-12 00:41:44,Haloklina by Jakub Strouhal,5.0,7.0,2.0,"January 1, 2023",0.0,0.0,0.0,0.0,7.0,,
9788088494065,2024-11-12 00:41:47,Organizační porno by Aneta Martinek,3.73,153.0,16.0,"September 1, 2023",2.0,8.0,53.0,57.0,33.0,,
9788088467816,2024-11-12 00:41:52,Balada pro Emily by Jarmila Stráníková,3.67,43.0,10.0,"October 21, 2023",1.0,3.0,15.0,14.0,10.0,,
9788088635505,2024-11-12 00:44:14,Bezejmenná touha by Honza Vojtíšek,4.11,9.0,2.0,"February 26, 2024",0.0,0.0,2.0,4.0,3.0,,
9788011036805,2024-11-12 00:44:22,Dívka z vyšší třídy by Hana Adler,3.0,3.0,1.0,"January 1, 2023",0.0,1.0,1.0,1.0,0.0,,
9788027801091,2024-11-12 00:46:48,"Operace Petragun (Legie, #8) by František Kotleta",4.21,126.0,11.0,"February 22, 2023",0.0,2.0,24.0,46.0,54.0,,
9788025744062,2024-11-12 00:47:16,Trosky Země by Petr Heteša,3.33,3.0,0.0,"April 30, 2024",0.0,0.0,2.0,1.0,0.0,,
9788024952246,2024-11-12 00:47:20,Rozmarná Anglie aneb Nikdy není tak zle by Alena Damijo,4.67,6.0,0.0,"January 1, 2023",0.0,0.0,0.0,2.0,4.0,,
9788025743706,2024-11-12 00:47:32,K Helmovskému jezu by Aleš Berný,0.0,0.0,0.0,"January 1, 2024",0.0,0.0,0.0,0.0,0.0,,
9788076619319,2024-11-12 00:47:35,"Motýl, který zapomněl létat by Vanessa Vernerová",3.73,11.0,4.0,"April 8, 2024",0.0,2.0,1.0,6.0,2.0,,
9788025741917,2024-11-12 00:47:40,Vilda: Příběh tančícího elegána Vildy Jakše by Dalibor Vácha,4.18,11.0,2.0,"January 1, 2023",0.0,0.0,3.0,3.0,5.0,,
9788027518234,2024-11-12 00:47:45,Čokoládová krev by Radka Denemarková,4.16,89.0,14.0,"December 6, 2023",1.0,4.0,13.0,33.0,38.0,,
9788088322429,2024-11-12 00:47:48,"Sex, chlast a bláznivá láska na Pobřeží hříchu by Michi Miky",4.0,1.0,0.0,"June 16, 2023",0.0,0.0,0.0,1.0,0.0,,
9788074373824,2024-11-12 00:47:56,Cestmír Suška: Things Outside by Cestmir Suska,0.0,0.0,0.0,"April 18, 2023",0.0,0.0,0.0,0.0,0.0,,
9788027137855,2024-11-12 00:48:01,Konzultant by Antonín Mazáč,4.33,12.0,3.0,"January 1, 2023",0.0,0.0,0.0,8.0,4.0,,
9788075886019,2024-11-12 00:48:03,"Jak se vaří netopýři (Josefína Divíšková, #7) by Marie Rejfová",3.62,13.0,2.0,"April 29, 2024",0.0,0.0,6.0,6.0,1.0,,
9788075686046,2024-11-12 00:50:29,"Dvanáct měsíců (Smrti se smát, #2) by Eleanor Corvin",4.32,41.0,7.0,"January 1, 2023",1.0,0.0,1.0,22.0,17.0,,
9788076911000,2024-11-12 00:50:34,"Hradní intrikáři (Bohemian Royals, #2) by Lena Valenová",4.17,23.0,5.0,"April 24, 2023",0.0,0.0,3.0,13.0,7.0,,
9788088488392,2024-11-12 00:50:37,Paní jara by Leandra Sold,4.08,24.0,7.0,"January 1, 2023",1.0,0.0,6.0,6.0,11.0,,
9788076660816,2024-11-12 00:50:47,Job v zahraničí: Největší životní jízda! by Jana Endlicherová,0.0,0.0,0.0,"January 1, 2023",0.0,0.0,0.0,0.0,0.0,,
9788024953779,2024-11-12 00:50:51,Krátký román o přátelství by Boris Dočekal,3.0,1.0,1.0,"March 18, 2024",0.0,0.0,1.0,0.0,0.0,,
9788074565649,2024-11-12 00:53:11,Krusta temné hvězdy   (Válka memů #3) by Richard Šusta,3.0,1.0,0.0,"April 18, 2024",0.0,0.0,1.0,0.0,0.0,,
9788076373990,2024-11-12 00:53:13,Rozložíš paměť by Marek Torčík,4.36,929.0,104.0,"January 1, 2023",1.0,9.0,109.0,347.0,463.0,,
9788028002992,2024-11-12 00:53:17,Mé celoživotní janáčkování: Hovory nejen o hudbě by Miloš Štedroň,0.0,0.0,0.0,"January 1, 2023",0.0,0.0,0.0,0.0,0.0,,
9788026444244,2024-11-12 00:53:22,Umění nemoci by Jan Vojáček,4.1,30.0,2.0,"March 23, 2023",1.0,0.0,6.0,11.0,12.0,,
9788027133123,2024-11-12 00:53:24,Neurologie pro humanitní obory by Miroslav Orel,0.0,0.0,0.0,"January 1, 2023",0.0,0.0,0.0,0.0,0.0,,
9788070552902,2024-11-12 00:53:31,Bájná knihovna by Kateřina Benešová,5.0,1.0,0.0,"October 1, 2023",0.0,0.0,0.0,0.0,1.0,,
9788011037062,2024-11-12 00:53:33,Svatá Temnota: Zelené pláště by Lenka Brabcová,4.0,1.0,0.0,"January 1, 2023",0.0,0.0,0.0,1.0,0.0,,
9788076860117,2024-11-12 00:53:45,Svět úžasné Báry by Barbora Janečková Vítová,4.17,6.0,1.0,"January 1, 2023",0.0,0.0,1.0,3.0,2.0,,
9788024288550,2024-11-12 00:53:47,Těla by Klára Vlasáková,3.91,1009.0,96.0,"January 1, 2023",6.0,54.0,249.0,414.0,286.0,,
9788025740910,2024-11-12 00:53:53,Až ke křížku by Klára Teršová,3.07,15.0,2.0,"January 1, 2023",1.0,2.0,8.0,3.0,1.0,,
9788027742547,2024-11-12 00:53:56,"Zvrhlá hra (Alfa & Omega, #1) by Tess M. Puffrová",3.68,99.0,10.0,"January 1, 2024",4.0,8.0,31.0,29.0,27.0,,
9788076290976,2024-11-12 00:53:59,Cesta za svobodou by Štěpán Sejbal,4.0,1.0,0.0,"January 1, 2023",0.0,0.0,0.0,1.0,0.0,,
9788027150625,2024-11-12 00:54:06,Soumrak husitů by Veronika Válková,4.35,17.0,4.0,"September 29, 2023",0.0,0.0,2.0,7.0,8.0,,
9788024290843,2024-11-12 00:54:10,Symbol Ludvík Svoboda by Jiří Fidler,2.0,1.0,0.0,"January 1, 2023",0.0,1.0,0.0,0.0,0.0,,
9788020461391,2024-11-12 00:54:14,Deník tramvajačky by Karolína Hubková,3.44,18.0,2.0,"May 1, 2023",0.0,3.0,5.0,9.0,1.0,,
9788024287348,2024-11-12 00:54:20,Déjà vu by David Urban,3.53,15.0,0.0,"January 1, 2023",0.0,1.0,6.0,7.0,1.0,,
9788088378198,2024-11-12 00:54:22,Stříbrný kouzelník by Jindřich Mann,3.79,14.0,0.0,"January 1, 2023",0.0,1.0,3.0,8.0,2.0,,
9788027522187,2024-11-12 00:54:26,Omrzlina by Kateřina Čupová,4.5,2.0,0.0,"January 1, 2024",0.0,0.0,0.0,1.0,1.0,,
9788027519569,2024-11-12 00:54:34,Být Homérem po Joyceovi by Jiří Trávníček,4.75,4.0,1.0,"January 1, 2024",0.0,0.0,0.0,1.0,3.0,,
9788024657943,2024-11-12 00:54:42,Praktická etika by Peter Singer,4.07,3346.0,196.0,"January 1, 1979",64.0,144.0,533.0,1.0,1.0,,
9788072587230,2024-11-12 00:54:48,Koncové světlo by Jan Tošovský,3.0,1.0,0.0,"January 1, 2020",0.0,0.0,1.0,0.0,0.0,,
9788088461081,2024-11-12 00:54:50,Zasněžené hory by Marie Jakoubková,2.0,2.0,1.0,"January 1, 2023",1.0,0.0,1.0,0.0,0.0,,
9788027721405,2024-11-12 00:54:52,V hrůze a krvi zrozeni by Kevin Wulfric Scherrer,3.46,13.0,1.0,"January 25, 2023",1.0,0.0,8.0,0.0,4.0,,
9788075160195,2024-11-12 00:55:02,13 objektů z (ne)šťastného muzea by Tereza Arndt,4.33,6.0,2.0,"January 1, 2022",0.0,0.0,0.0,4.0,2.0,,
9788026724599,2024-11-12 00:55:07,Vraní oko by Michaela Klevisová,4.22,250.0,20.0,"March 28, 2023",0.0,2.0,39.0,110.0,99.0,,
9788024287409,2024-11-12 00:57:30,Feministkou snadno a rychle by Lucie Jarkovská,4.29,256.0,40.0,"January 1, 2023",1.0,5.0,31.0,102.0,117.0,,
9788090878013,2024-11-12 00:57:34,Sauronova nevěsta by Emma Surdu,1.43,7.0,2.0,"January 30, 2023",6.0,0.0,0.0,1.0,0.0,,
9788088465089,2024-11-12 00:57:36,Mína a náhodní kolemjdoucí by Kateřina Pantovič,4.44,9.0,1.0,"January 1, 2023",0.0,0.0,1.0,3.0,5.0,,
9788026725459,2024-11-12 00:57:40,Desetkrát a dost by Scarlett Wilková,3.4,52.0,4.0,"October 19, 2023",0.0,8.0,21.0,17.0,6.0,,
9788090873520,2024-11-12 00:57:46,Na opačné straně času by Aleš Rozehnal,1.0,2.0,0.0,"May 24, 2024",2.0,0.0,0.0,0.0,0.0,,
9788076617261,2024-11-12 00:57:48,Jsme nevyhnutelní (Navždycky #4) by Nofreeusernames,4.0,594.0,92.0,"May 8, 2023",8.0,37.0,120.0,213.0,216.0,,
9788088467687,2024-11-12 00:57:53,Biograf láska by Uljana Donátová,3.25,4.0,0.0,"January 1, 2023",0.0,1.0,1.0,2.0,0.0,,
9788090876408,2024-11-12 00:57:54,Otevřely se dveře by Jiří Staněk,2.0,2.0,0.0,"January 1, 2023",0.0,2.0,0.0,0.0,0.0,,
9788027907908,2024-11-12 00:57:56,Večírek s hořkým koncem by Veronika Černucká,4.0,2.0,0.0,"January 1, 2023",0.0,0.0,0.0,2.0,0.0,,
9788026724919,2024-11-12 00:58:00,"Kde jsi, když nejsi by Radka Třeštíková",3.81,665.0,61.0,"June 1, 2023",23.0,43.0,156.0,256.0,187.0,,
9788088635550,2024-11-12 01:00:21,Smečka by Jiří Sivok,4.59,29.0,15.0,"April 29, 2024",0.0,0.0,1.0,10.0,18.0,,
9788090818538,2024-11-12 01:00:24,Mezitah: Chyba lávky by Albert Maršík,0.0,0.0,0.0,"September 1, 2023",0.0,0.0,0.0,0.0,0.0,,
9788076701199,2024-11-12 01:00:33,Kůrovci by Jiri Hulcr,4.31,13.0,5.0,"January 1, 2022",0.0,0.0,2.0,5.0,6.0,,
9788020463029,2024-11-12 01:00:35,Když za nás Bůh netahá kaštany z ohně by Renata Kalenská,4.0,22.0,2.0,"March 28, 2024",0.0,3.0,3.0,7.0,9.0,,
9788024949949,2024-11-12 01:00:45,Návrat nežádoucí by Lenka Potůčková,3.94,17.0,2.0,"March 1, 2023",0.0,1.0,5.0,5.0,6.0,,
9788027130658,2024-11-12 01:00:48,Praha v proměnách času by Petr Sojka,4.0,6.0,2.0,"October 26, 2023",0.0,0.0,2.0,2.0,2.0,,
9788027152414,2024-11-12 01:00:50,Účetnictví pro úplné začátečníky 2024 by Pavel   Novotný,4.0,1.0,0.0,"January 19, 2024",0.0,0.0,0.0,1.0,0.0,,
9788027151820,2024-11-12 01:00:58,Psychologie pro každý den aneb Co nás ve škole o nás ani druhých neučili by Jan   Urban,0.0,0.0,0.0,"January 1, 2023",0.0,0.0,0.0,0.0,0.0,,
9788088378303,2024-11-12 01:01:00,Sudetenlove by Filip Raif,4.02,44.0,3.0,"January 1, 2023",0.0,3.0,8.0,18.0,15.0,,
9788073766900,2024-11-12 01:01:05,Spiknutí: Pravda o pokusu odstranit prezidenta ČR by Luboš Procházka,4.0,1.0,0.0,"January 1, 2024",0.0,0.0,0.0,1.0,0.0,,
9788088256267,2024-11-12 01:01:07,"Oskar Spielmann: Brno, Alger, Toulon by Ivo Habán",0.0,0.0,0.0,"January 1, 2023",0.0,0.0,0.0,0.0,0.0,,
9788088635871,2024-11-12 01:01:13,Ve spárech múzy by Tomáš Marton,4.5,4.0,1.0,"August 26, 2024",0.0,0.0,0.0,2.0,2.0,,
9788076373310,2024-11-12 01:01:17,Velké dějiny zemí Koruny české: Lékařství by Karel Černý,4.5,2.0,0.0,"January 1, 2023",0.0,0.0,0.0,1.0,1.0,,
9788087908723,2024-11-12 01:01:19,Dokumenty by Kamil Bouška,4.75,4.0,0.0,"January 1, 2023",0.0,0.0,0.0,1.0,3.0,,
9788020722348,2024-11-12 01:01:23,Dům v Matoušově ulici by Tereza Boučková,3.35,31.0,8.0,"January 1, 2024",4.0,2.0,10.0,9.0,6.0,,
9788075884534,2024-11-12 01:01:26,Spálená země: kniha první by Jakub Hoza,3.73,15.0,0.0,"April 28, 2023",1.0,0.0,5.0,5.0,4.0,,
9788074374159,2024-11-12 01:01:29,Zdeněk Beran: Elevation by unknown author,0.0,0.0,0.0,,0.0,0.0,0.0,0.0,0.0,,
9788074434990,2024-11-12 01:01:30,London Calling by Krista Kašpar,3.67,6.0,0.0,"January 1, 2023",0.0,0.0,2.0,4.0,0.0,,
9788027515950,2024-11-12 01:01:32,Hezké počasí by Radek Štěpánek,4.25,12.0,2.0,"January 1, 2023",0.0,0.0,1.0,7.0,4.0,,
9788024294124,2024-11-12 01:01:37,Římská jízda by Jan Drbohlav,2.5,2.0,1.0,"November 1, 2023",1.0,0.0,0.0,1.0,0.0,,
9788072279005,2024-11-12 01:01:42,Pasáže by Michal Ajvaz,4.75,4.0,0.0,"January 1, 2024",0.0,0.0,0.0,1.0,3.0,,
