GR_isbn,GR_date,GR_title,GR_rating,GR_ratings_count,GR_reviews,GR_published,GR_1_stars,GR_2_stars,GR_3_stars,GR_4_stars,GR_5_stars,GR_pages,GR_format
9788090841512,2024-04-14 01:16:03,Zrození metropole: Ostrava ve fotografiích padesátých a šedesátých let 20. století by Ondřej Durczak,3.75,4.0,1.0,"January 1, 2022",,,,,,,
9788026219408,2024-04-14 01:16:09,Terapie mezi stromy by Adam Táborský,4.0,1.0,0.0,"January 1, 2023",,,,,,,
9788026220497,2024-04-14 01:16:13,Nebuď p*ča aneb jak (ne)pracovat s dětmi by Tomáš Morávek,4.24,100.0,12.0,"January 1, 2023",,,,,,,
9788027151707,2024-04-14 01:16:23,"Automobily - Výkladový slovník: Jména, značky a znaky by Jiří Fiala",0.0,0.0,0.0,"January 1, 2024",,,,,,,
9788074229404,2024-04-14 01:16:24,Dějiny Španělska by Jiří Chalupa,0.0,0.0,0.0,"December 28, 2023",,,,,,,
9788024287744,2024-04-14 01:16:34,Dokud dýchám by Aleš Novotný,4.2,46.0,3.0,"April 1, 2023",,,,,,,
9788026446415,2024-04-14 01:16:37,Moje upřímná posedlost jménem anorexie by Petra Lukešová,3.37,19.0,6.0,"January 1, 2023",,,,,,,
9788025363188,2024-04-14 01:16:39,Noc pro chrliče by Filip Kalčák,3.35,17.0,3.0,"July 20, 2023",,,,,,,
9788024291741,2024-04-14 01:16:41,Letní bouřky by Klára Pospíšilová,4.11,136.0,23.0,"July 24, 2023",,,,,,,
9788076910706,2024-04-14 01:16:47,Království v kameni by Nela Mičková,4.07,15.0,1.0,"July 1, 2023",,,,,,,
9788024293233,2024-04-14 01:16:49,Za pět minut zvoní by Michaela Merglová,3.72,43.0,7.0,"January 1, 2024",,,,,,,
9788076618732,2024-04-14 01:16:56,"Pád temnoty (Arila, #4) by Radek Starý",4.23,26.0,2.0,"November 20, 2023",,,,,,,
9788024289472,2024-04-19 22:28:57,Sochař by Artur Janoušek,3.25,4.0,1.0,"January 1, 2023",,,,,,,
9788088367291,2024-04-19 22:29:00,I smutek byl jen sen. Poezie Josefa Kocourka by Josef Kocourek,4.0,1.0,0.0,"January 1, 2023",,,,,,,
9788072529704,2024-04-19 22:29:02,Hranice zvrhlosti by Jan  Urban,3.29,14.0,3.0,"May 15, 2023",,,,,,,
9788090837690,2024-04-19 22:29:04,Z pera knihomolů: 11 povídek od českých a slovenských knižních blogerů by Eliška Hronová,3.85,144.0,29.0,"March 31, 2023",,,,,,,
9788075884374,2024-04-19 22:29:10,"Stará béčková legenda (Stará béčková legenda, #1) by Shigor Birdman",4.14,22.0,6.0,"April 3, 2023",,,,,,,
9788088067757,2024-04-19 22:29:12,Není nebe nad Mexikem by Michal Březina,3.4,5.0,1.0,"April 3, 2023",,,,,,,
9788072444816,2024-04-19 22:29:17,Město nad městem by Lucie Brejšová,4.64,14.0,7.0,"May 9, 2023",,,,,,,
9788027801145,2024-04-19 22:29:21,Prázdnota by Michaela Merglová,3.63,35.0,14.0,"January 1, 2023",,,,,,,
9788081116148,2024-04-19 22:29:25,„Jmenuji se Eva…“ by Jana Mirovská,4.43,7.0,3.0,"January 1, 2023",,,,,,,
9788076617254,2024-04-19 22:29:29,"Síla obsidiánu (Tajemství obsidiánu, #3) by Petra Martišková",3.97,32.0,4.0,"May 8, 2023",,,,,,,
9788024288826,2024-04-19 22:29:32,Ve škole i za školou by Alena Mornštajnová,4.08,12.0,0.0,"January 1, 2023",,,,,,,
9788075884497,2024-04-19 22:29:35,Bastard by Jaroslav Mostecký,4.4,5.0,0.0,"April 18, 2023",,,,,,,
9788075512475,2024-04-19 22:29:37,Temnota by Kristýna Freiová,2.0,1.0,0.0,"January 1, 2022",,,,,,,
9788075941336,2024-04-19 22:29:39,Lovci monster - Fantom by Larry Correia,4.37,19.0,5.0,"April 17, 2023",,,,,,,
9788076017481,2024-04-19 22:29:43,Květy z nahořklého dřeva by Jan Skácel,4.95,22.0,2.0,"January 1, 2000",,,,,,,
9781847498885,2024-04-19 22:29:45,The Raven and Other Poems: Fully Annotated Edition with over 400 notes. It contains Poe's complete poems and three essays on poetry by Edgar Allan Poe,4.3,45017.0,737.0,"January 29, 1845",,,,,,,
9788088467649,2024-04-19 22:29:48,Koloušek by Jana Bernášková,3.44,52.0,6.0,"January 1, 2023",,,,,,,
9788075884619,2024-04-19 22:29:50,Povídky smíchovské by Marie Rejfová,3.87,15.0,3.0,"May 3, 2023",,,,,,,
9788072278893,2024-04-19 22:29:52,Matka měla ráda třešně by Jiří Dynka,3.5,2.0,0.0,"January 1, 2023",,,,,,,
9788025740910,2024-04-19 22:29:55,Až ke křížku by Klára Teršová,3.13,8.0,1.0,"January 1, 2023",,,,,,,
9788027721405,2024-04-19 22:29:58,V hrůze a krvi zrozeni by Kevin Wulfric Scherrer,3.7,10.0,1.0,"January 25, 2023",,,,,,,
9788076900387,2024-04-19 22:30:01,Úzkost je rozkoš II/II: … nejsem nebudu nebyl jsem by Karel Šebek,5.0,2.0,0.0,"January 1, 2023",,,,,,,
9788026446965,2024-04-19 22:30:06,Věčně věrný nepřítel - anorexie by Michaela Hošková,3.0,5.0,2.0,"January 1, 2023",,,,,,,
9788076110809,2024-04-19 22:30:09,Zpověď posledního mnicha by František Kalenda,3.67,6.0,1.0,"May 2, 2023",,,,,,,
9788072157198,2024-04-19 22:30:12,Básně (Spisy II) by Karel Kryl,4.4,10.0,0.0,"January 1, 1997",,,,,,,
9788026724759,2024-04-19 22:30:14,Proti srsti by Klára Mandausová,4.5,2.0,1.0,"January 1, 2023",,,,,,,
9788090856844,2024-04-19 22:30:24,Tetam by Petya Stach,4.0,2.0,0.0,"January 1, 2023",,,,,,,
9788090856837,2024-04-19 22:30:26,Pommes frites by Jan Valík,1.5,2.0,0.0,"January 1, 2023",,,,,,,
9788090856851,2024-04-19 22:30:28,Nepůvodní druhy by Tomáš Tománek,3.33,3.0,0.0,"January 1, 2023",,,,,,,
9788088467687,2024-04-19 22:30:32,Biograf láska by Uljana Donátová,3.25,4.0,0.0,"January 1, 2023",,,,,,,
9788088488392,2024-04-19 22:30:33,Paní jara by Leandra Sold,3.89,19.0,6.0,"January 1, 2023",,,,,,,
9788075884701,2024-04-19 22:30:36,"Strašidlo minulosti (Ota Fink, #8) by Jaroslav Velinský",4.5,8.0,2.0,"January 1, 2023",,,,,,,
9788088346234,2024-04-19 22:30:40,Elektrickej strom by Jarmila Kašparová,4.44,9.0,2.0,"June 26, 2023",,,,,,,
9788025741078,2024-04-19 22:30:43,Rozehraný život by Lubomir Kavalek,4.0,1.0,0.0,"May 10, 2023",,,,,,,
9788074434907,2024-04-19 22:30:47,Křížeček na čelo by Eva Marie Růžena,2.71,7.0,1.0,"January 1, 2023",,,,,,,
9788074434914,2024-04-19 22:30:49,Epocha žárovky by Martin Dytko,3.0,4.0,0.0,"January 1, 2023",,,,,,,
9788090856882,2024-04-19 22:30:52,<30 by Anežka Nováková,2.0,1.0,0.0,"January 1, 2023",,,,,,,
9788088067856,2024-04-19 22:30:56,Rovnováha by Petr Švec,4.2,5.0,2.0,"May 22, 2023",,,,,,,
9788090856820,2024-04-19 22:31:01,Haloklina by Jakub Strouhal,5.0,7.0,2.0,"January 1, 2023",,,,,,,
9788024950839,2024-04-19 22:31:04,Životní (s)milníky by Jitka Slavíková,0.0,0.0,0.0,"June 1, 2023",,,,,,,
9788024951300,2024-04-19 22:31:06,Kapitánova čest by Lucie Jehličková,3.0,2.0,0.0,"August 1, 2023",,,,,,,
9788073294847,2024-04-19 22:31:10,Trnková zima by Anna Malchárková,5.0,1.0,1.0,"January 1, 2023",,,,,,,
9788076339538,2024-04-19 22:31:12,Písnička pro Klaudii by Petra Langová,3.8,10.0,1.0,"May 12, 2023",,,,,,,
9788024651729,2024-04-19 22:31:14,Transfigured Night (Modern Czech Classics) by Libuše Moníková,3.67,9.0,3.0,"September 19, 2023",,,,,,,
9788026724964,2024-04-19 22:31:16,Mezi nimi by Veronika González,4.0,46.0,4.0,"January 1, 2023",,,,,,,
9788027909988,2024-04-19 22:31:22,Vražedná krása by Jaroslava Černá,5.0,1.0,1.0,"January 1, 2023",,,,,,,
9788027909872,2024-04-19 22:31:24,"Katův odkaz (Letopisy královské komory, #17) by Vlastimil Vondruška",4.0,4.0,0.0,"January 1, 2023",,,,,,,
9788027515745,2024-04-19 22:31:27,Uhrwerk by Bogdan Trojak,3.0,4.0,0.0,"January 1, 2023",,,,,,,
9788027722372,2024-04-19 22:31:30,Teorie býka by Magdalena Maxová,3.88,26.0,5.0,"January 1, 2023",,,,,,,
9788075304278,2024-04-19 22:31:32,Poslední divoké objetí by Luděk Čertík,4.5,2.0,1.0,"June 14, 2023",,,,,,,
9788027910014,2024-04-19 22:31:37,Kronika hříšného kněze aneb Bestie z Karlštejna by Naďa Horáková,3.6,5.0,1.0,"January 1, 2023",,,,,,,
9788025741528,2024-04-19 22:31:39,Pod Kaštanem by Barbora Majchráková,3.0,6.0,2.0,"June 15, 2023",,,,,,,
9788027909995,2024-04-19 22:31:41,Bůh lovu by Věra Mertlíková,3.0,3.0,1.0,"January 1, 2023",,,,,,,
9788027910199,2024-04-19 22:31:43,Cejch by Zdeněk Šmíd,4.13,40.0,5.0,"January 1, 1992",,,,,,,
9788024288734,2024-04-19 22:31:49,Prokletí domu U Dvou růží by Jan  Bauer,0.0,0.0,0.0,"January 1, 2023",,,,,,,
9788075464620,2024-04-19 22:31:51,Trnitá cesta by Sarah Parsley,3.33,3.0,0.0,"January 1, 2023",,,,,,,
9788027910236,2024-04-19 22:31:53,Kdo ti píše? by Dagmar Digma Čechová,4.33,3.0,1.0,"January 1, 2023",,,,,,,
9788027910045,2024-04-19 22:31:56,smrt hraje vrhcáby by Martina Novotná,3.0,1.0,0.0,"January 1, 2023",,,,,,,
9788027910106,2024-04-19 22:31:59,Předloha pro vraždu by Eva Mašková,2.67,3.0,2.0,"January 1, 2023",,,,,,,
9788025741917,2024-04-19 22:32:04,Vilda: Příběh tančícího elegána Vildy Jakše by Dalibor Vácha,4.1,10.0,2.0,"January 1, 2023",,,,,,,
9788025741429,2024-04-19 22:32:06,Poslední kacíř by Martin Chadima,2.71,7.0,2.0,"January 1, 2023",,,,,,,
9788025741863,2024-04-19 22:32:08,Amsterodamské vigilie by Lenka Horňáková-Civade,3.4,10.0,4.0,"January 1, 2023",,,,,,,
9788025742303,2024-04-19 22:32:13,Evropanka: Historky z Polesí by Alexej Sevruk,4.0,12.0,0.0,"January 1, 2023",,,,,,,
9788025742778,2024-04-19 22:32:15,Výstava chameleonů by Filip Mikuš,5.0,1.0,0.0,"January 1, 2023",,,,,,,
9788088437109,2024-04-19 22:32:18,Krvavý náhrobek by Anna Beatrix Bártová,3.56,9.0,5.0,"June 1, 2023",,,,,,,
9788074565403,2024-04-19 22:32:24,Strnadův efekt by Jan Kotouč,4.35,23.0,4.0,"January 1, 2023",,,,,,,
9788025742365,2024-04-19 22:32:25,Město v mlze by Jaroslav Konáš,4.0,26.0,9.0,"January 1, 2023",,,,,,,
9788025743188,2024-04-19 22:32:28,Rváčov 2 by Džian Baban,4.25,4.0,0.0,"January 1, 2023",,,,,,,
9788082860019,2024-04-19 22:32:31,Na kolenách by Alica Cárska,3.85,41.0,10.0,"January 1, 2023",,,,,,,
9788024292342,2024-04-19 22:32:34,Zvedá se vítr by Kateřina Surmanová,3.69,96.0,15.0,"September 1, 2023",,,,,,,
9788024951706,2024-04-19 22:32:37,Italské mentolky by Marta Kučíková,3.6,5.0,2.0,"September 1, 2023",,,,,,,
9788088483502,2024-04-19 22:32:38,Psina s princem by Petra Nachtmanová,0.0,0.0,0.0,"January 1, 2023",,,,,,,
9788089550920,2024-04-19 22:32:40,Dolniaci by Ivan Habaj,3.5,2.0,0.0,"January 1, 1972",,,,,,,
9788074434976,2024-04-19 22:32:43,Hořím v kameni by Marie Jehličková,4.0,2.0,2.0,"June 1, 2023",,,,,,,
9788074434891,2024-04-19 22:32:46,Nějaké ženy a jacísi muži by Alena Zemančíková,4.0,2.0,0.0,"January 1, 2023",,,,,,,
9788090889804,2024-04-19 22:32:48,Kastelán by Maximilián Kavalír,2.0,1.0,1.0,"January 1, 2023",,,,,,,
9788088635109,2024-04-19 22:32:50,Zresetuj mě by Michal Sirotek,4.83,6.0,2.0,"June 26, 2023",,,,,,,
9788088635062,2024-04-19 22:32:53,Pomiluj smrt by Veronika Fiedlerová,4.0,13.0,1.0,"January 1, 2023",,,,,,,
9788088067993,2024-04-19 22:32:55,Sešívance: Druhý steh by Honza Vojtíšek,3.6,5.0,1.0,"January 1, 2023",,,,,,,
9788075211828,2024-04-19 22:32:59,Poslední cestopisy by Zofia Bałdyga,4.74,19.0,1.0,"January 1, 2023",,,,,,,
9788024951560,2024-04-19 22:33:02,Perly v botě by Jakub Kohák,0.0,0.0,0.0,"September 1, 2023",,,,,,,
9788076624931,2024-04-19 22:33:04,"Kniha, kterou posypal hvězdný prach by Nora Eckhardtová",3.52,73.0,11.0,"August 1, 2023",,,,,,,
9788024951652,2024-04-19 22:33:07,Rozinky v blátě by David Jan Novotný,5.0,1.0,0.0,,,,,,,,
9788087908648,2024-04-19 22:33:09,Povyk by Božena Správcová,4.0,1.0,0.0,"January 1, 2023",,,,,,,
9788020721839,2024-04-19 22:33:10,Tchyně nemá jazyk by Kateřina Rudčenková,3.53,15.0,1.0,"September 1, 2023",,,,,,,
9788075501455,2024-04-19 22:33:15,Sidonie by Věra Pasiarová,4.0,1.0,0.0,"January 1, 2023",,,,,,,
9788074043741,2024-04-19 22:33:18,Zloděj tváří by Arnošt Vašíček,3.0,4.0,2.0,"January 1, 2023",,,,,,,
9788075211224,2024-04-19 22:33:20,Výlet do Schengenu / Můj jediný čtenář by Jonáš Hájek,3.6,5.0,2.0,"January 1, 2023",,,,,,,
9788025363850,2024-04-19 22:33:26,Trnitá kletba by Anežka Kočová,4.08,48.0,10.0,"August 31, 2023",,,,,,,
9788020721723,2024-04-19 22:33:29,Žena ve tvaru sklenice by Irena Šťastná,3.4,5.0,0.0,"January 1, 2023",,,,,,,
9788024951898,2024-04-19 22:33:31,Svatební historky aneb Jak jsem se nevdala by Lucie Macháčková,3.71,56.0,12.0,"January 1, 2023",,,,,,,
9788024292182,2024-04-19 22:33:34,Po stopách zločinů by Alena Mornštajnová,3.71,14.0,1.0,"October 1, 2023",,,,,,,
9788088488446,2024-04-19 22:33:36,Vrčící naděje by Lenka Hnátová,3.6,5.0,1.0,"January 1, 2023",,,,,,,
9788072225743,2024-04-19 22:33:39,Kriminální případy z Orlických hor 2 by Jiří Mach,3.0,1.0,0.0,"July 1, 2023",,,,,,,
9788027910137,2024-04-19 22:33:42,"Jak se do lesa volá (Martin Stein, #3) by Marie Horová",3.0,1.0,0.0,"January 1, 2023",,,,,,,
9788027722389,2024-04-19 22:33:45,Koruna otráveného stromu by Vlaďka Sacká,3.33,6.0,2.0,"January 1, 2023",,,,,,,
9788090876408,2024-04-19 22:33:47,Otevřely se dveře by Jiří Staněk,2.0,1.0,0.0,"January 1, 2023",,,,,,,
9788088396161,2024-04-19 22:33:52,Klošár aneb Co si mamlasové povídali by Jiří Kratochvil,4.0,2.0,0.0,"January 1, 2023",,,,,,,
9788024951157,2024-04-19 22:33:54,Karel IV. – Vzpoura vévodů by Jaromír Jindra,0.0,0.0,0.0,"August 1, 2023",,,,,,,
9788024292724,2024-04-19 22:33:56,Zítra přijde Olah by Martin Sichinger,3.91,23.0,3.0,"September 1, 2023",,,,,,,
9788024293271,2024-04-19 22:34:03,Největší záhady zločinu by Jaroslav V. Mareš,3.67,6.0,1.0,"January 1, 2023",,,,,,,
9788024951713,2024-04-19 22:34:08,Kam jede tohle nástupiště by Iva Pekárková,3.75,12.0,2.0,"October 1, 2023",,,,,,,
9788024951577,2024-04-19 22:34:11,Bobky a fajnový koření by Zuzana Hubeňáková,3.33,3.0,1.0,"September 1, 2023",,,,,,,
9788024951256,2024-04-19 22:34:13,Anežka z Kuenringu: První po královně by Hana Parkánová-Whitton,3.0,2.0,1.0,"October 1, 2023",,,,,,,
9788074926723,2024-04-19 22:34:15,Z Babylonu do Silicon Valley a zpět? by Jan Jakub Šalomoun,4.5,2.0,1.0,"January 1, 2023",,,,,,,
9788024292885,2024-04-19 22:34:19,Srdce z ledu by Jitka Ludvíková,4.8,5.0,0.0,"October 1, 2023",,,,,,,
9788090832503,2024-04-19 22:34:23,Nevím by Josef Formánek,0.0,0.0,0.0,"January 1, 2023",,,,,,,
9788090828995,2024-04-19 22:34:25,13! by Pavel Tomeš,3.94,34.0,3.0,"January 1, 2023",,,,,,,
9788072605712,2024-04-19 22:34:27,Toyen: první dáma surrealismu by Andrea Sedláčková,4.94,17.0,3.0,"January 1, 2023",,,,,,,
9788027515967,2024-04-19 22:34:29,Zbabělí hrdinové by Simona Bohatá,3.38,8.0,1.0,"January 1, 2023",,,,,,,
9788027910182,2024-04-19 22:34:31,Sagittarius by Václav Křivanec,2.2,5.0,1.0,"January 1, 2023",,,,,,,
9788027151783,2024-04-19 22:34:33,Rty s příchutí vína by Aleš Novotný,3.81,37.0,11.0,"January 1, 2023",,,,,,,
9788027517886,2024-04-19 22:34:36,Legendy a litanie by Radek Malý,4.0,1.0,0.0,"January 1, 2023",,,,,,,
9788027517701,2024-04-19 22:34:38,Lenochod Jimmy & jeho backup band by Pavel Bareš,4.15,113.0,25.0,"October 3, 2023",,,,,,,
9788075212153,2024-04-19 22:34:46,Zbabělé zápisky z ukrajinské války by Adéla Knapová,3.33,12.0,2.0,"January 1, 2023",,,,,,,
9788074535277,2024-04-19 22:34:48,Návrat by Kateřina Pojkarová,3.33,3.0,0.0,"January 1, 2014",,,,,,,
9788026448464,2024-04-19 22:34:50,Deníček Camille G: Troječka by Camille G,4.0,1.0,0.0,"January 1, 2023",,,,,,,
9788024951416,2024-04-19 22:34:52,Ďábelská tvář by Klára Janečková,2.67,3.0,0.0,"January 1, 2002",,,,,,,
9788088635185,2024-04-19 22:34:57,Polibek Choroby by Tom Gottwald,3.29,7.0,2.0,"July 31, 2023",,,,,,,
9788027518128,2024-04-19 22:35:01,Vyhoření by Petr Šesták,3.77,60.0,9.0,"January 1, 2023",,,,,,,
9788027518111,2024-04-19 22:35:05,Taneční hodiny dělníků dřevařského závodu by Václav Vomáčka,0.0,0.0,0.0,"January 1, 2023",,,,,,,
9788027517619,2024-04-19 22:35:06,Pláňata by Petra Dvořáková,3.85,248.0,28.0,"October 1, 2023",,,,,,,
9788027517909,2024-04-19 22:35:10,Němé duše by Jitka Ládrová,3.15,26.0,9.0,"January 1, 2023",,,,,,,
9788090829978,2024-04-19 22:35:12,Padlý anděl by Petra Kamlachová,3.67,3.0,0.0,"August 10, 2023",,,,,,,
9788027518142,2024-04-19 22:35:16,Vážný román by Pavel Zajíc,4.0,2.0,0.0,"January 1, 2023",,,,,,,
9788076374041,2024-04-19 22:35:17,Láska je kurva a jiné povídky by Petr Šabach,3.67,9.0,0.0,"October 1, 2023",,,,,,,
9788088641018,2024-04-19 22:35:19,"Rád čichám ke zvířatům, která jsi vycpala ty by Luboš Svoboda",4.14,14.0,2.0,"January 1, 2023",,,,,,,
9788027517459,2024-04-19 22:35:21,"Nekonečný krok (Koruna snů, #2) by Jan Kucin",4.33,3.0,0.0,"November 24, 2023",,,,,,,
9788076960008,2024-04-19 22:35:22,Jen jednou za věčnost by Martin Vopěnka,0.0,0.0,0.0,"January 1, 2023",,,,,,,
9788090818538,2024-04-19 22:35:25,Mezitah: Chyba lávky by Albert Maršík,0.0,0.0,0.0,"September 1, 2023",,,,,,,
9788026511854,2024-04-19 22:35:30,Náměsíční vrazi by Stanislava Veselá,4.16,43.0,3.0,"January 1, 2023",,,,,,,
9788026725114,2024-04-19 22:35:33,Kafe a chlup: Příběhy z kočičí kavárny by Michaela  Šalé,4.2,5.0,2.0,"January 1, 2023",,,,,,,
9788026449119,2024-04-19 22:35:35,Skutečné zločiny na Plzeňsku by František Müller,4.37,19.0,1.0,"September 21, 2023",,,,,,,
9788026725350,2024-04-19 22:35:37,"Devátý neznámý (Emily a komorník, #2) by Jan Gardner",3.18,11.0,2.0,"September 28, 2023",,,,,,,
9788026725220,2024-04-19 22:35:39,Hotel Atlantic by Barbora Šťastná,4.37,38.0,7.0,"January 1, 2023",,,,,,,
9788076911215,2024-04-19 22:35:43,Devatero hádek by Zuzana Koukalová,4.0,2.0,0.0,"September 25, 2023",,,,,,,
9788076910997,2024-04-19 22:35:46,Transmelancholie by Zašek,4.25,12.0,2.0,"September 11, 2023",,,,,,,
9788076910911,2024-04-19 22:35:50,Rozchodové řízení by Petr  Procházka,2.0,5.0,1.0,"September 11, 2023",,,,,,,
9788076900554,2024-04-19 22:35:54,Já papír vím o stromech… by Sona Kocianova,5.0,1.0,0.0,"January 1, 2023",,,,,,,
9788027517602,2024-04-19 22:35:57,Století na vlnách by Markéta Hejkalová,3.5,4.0,1.0,"January 1, 2023",,,,,,,
9788087720257,2024-04-19 22:36:02,"Hector (Jezdci apokalypsy, #4) by Marcy Jell",4.1,20.0,3.0,"February 1, 2024",,,,,,,
9788074434983,2024-04-19 22:36:05,Na cvičišti. Bojiště by Daniel Hradecký,4.11,9.0,3.0,"January 1, 2023",,,,,,,
9788027518043,2024-04-19 22:36:10,Transfer by Bianca Bellová,3.4,63.0,6.0,"January 1, 2023",,,,,,,
9788027724376,2024-04-19 22:36:12,Sudetenland by Leoš Kyša,3.72,271.0,39.0,"September 27, 2023",,,,,,,
9788075464798,2024-04-19 22:36:19,Můj sexy šéf by Renáta Navrátilová,2.86,7.0,1.0,"January 1, 2023",,,,,,,
9788076339651,2024-04-19 22:36:21,Poslední Přemyslovna: Vzdor a láska princezny Anežky by Melita Denková,1.0,2.0,1.0,"January 1, 2023",,,,,,,
9788024290232,2024-04-19 22:36:24,Pláč němého boha - 2. svazek by Tereza Matoušková,4.5,16.0,4.0,"September 15, 2023",,,,,,,
9788024952512,2024-04-19 22:36:29,Co tě nezabije by Aňa Geislerová,3.47,58.0,4.0,"January 1, 2023",,,,,,,
9788027720613,2024-04-19 22:36:31,Černobyl: Pád Atomgradu by Matyáš Namai,4.19,72.0,51.0,"September 20, 2023",,,,,,,
9788075513045,2024-04-19 22:36:36,Wavesbury: Romance pod gilotinou by David Návara,4.0,1.0,0.0,"August 21, 2023",,,,,,,
9788024294094,2024-04-19 22:36:40,"Milost, pane prezidente by Josef Klíma",2.67,3.0,1.0,"November 1, 2023",,,,,,,
9788088436096,2024-04-19 22:36:43,Dvě prázdná místa by Zuzana Holčíková,3.71,7.0,1.0,"January 1, 2023",,,,,,,
9788027904709,2024-04-19 22:36:45,Dvojitý šach by Jan Michl,4.0,1.0,0.0,"January 1, 2023",,,,,,,
9788024952246,2024-04-19 22:36:46,Rozmarná Anglie aneb Nikdy není tak zle by Alena Damijo,4.67,3.0,0.0,"January 1, 2023",,,,,,,
9788027801299,2024-04-19 22:36:49,Likvidátor by Honza Slívka,4.3,10.0,1.0,"August 23, 2023",,,,,,,
9788026725442,2024-04-19 22:36:58,Krutý měsíc by Jana Jašová,4.52,23.0,2.0,"November 2, 2023",,,,,,,
9788027801329,2024-04-19 22:37:00,Mirzova vize by Josef Pecinovský,3.58,19.0,2.0,"August 25, 2023",,,,,,,
9788076625372,2024-04-19 22:37:01,Most špionů aneb má cesta z pekla ke svobodě by Jaroslav Javorský,4.0,1.0,0.0,"October 16, 2023",,,,,,,
9788026449591,2024-04-19 22:37:03,Neodpovídej... by Lucie Bechynková,2.95,160.0,27.0,"October 19, 2023",,,,,,,
9788024292847,2024-04-19 22:37:09,"Fialky, tajemství a jiné povídky by Daniela Fischerová",4.17,12.0,2.0,"September 1, 2023",,,,,,,
9788090795358,2024-04-19 22:37:12,Mýtinami by Klára Krásenská,4.42,12.0,1.0,"January 1, 2023",,,,,,,
9788076373983,2024-04-19 22:37:15,Přístav by Magdalena Rejžková,3.39,23.0,3.0,"September 1, 2023",,,,,,,
9788076374010,2024-04-19 22:37:17,Neviditelné řemeslo: Tajemství redakční práce by Jakub Sedláček,4.32,22.0,1.0,"October 1, 2023",,,,,,,
9788076374003,2024-04-19 22:37:20,Fosilie by Michal Kašpárek,4.13,339.0,38.0,"September 20, 2023",,,,,,,
9788075304391,2024-04-19 22:37:24,Vulturnus by Ewald Murrer,5.0,1.0,0.0,"January 1, 2023",,,,,,,
9788076018723,2024-04-19 22:37:27,Zapomenutá by Jiří Klečka,3.54,13.0,4.0,"October 23, 2023",,,,,,,
9788076373990,2024-04-19 22:37:32,Rozložíš paměť by Marek Torčík,4.43,344.0,43.0,"October 25, 2023",,,,,,,
9788090818859,2024-04-19 22:37:37,V šedi by Milada Střítezská,5.0,3.0,1.0,"January 1, 2023",,,,,,,
9788090818583,2024-04-19 22:37:39,Prázdniny by Tomáš  Staněk,3.86,7.0,2.0,"June 1, 2021",,,,,,,
9788024952352,2024-04-19 22:37:42,Syn draka by Kristýna Freiová,1.0,1.0,1.0,"November 1, 2023",,,,,,,
9788024294148,2024-04-19 22:37:44,Octobriana by Marek Berger,4.0,1.0,0.0,"January 1, 2023",,,,,,,
9788088428329,2024-04-19 22:37:46,Vánoční povídky ze Šumavy by Karel Klostermann,4.0,1.0,1.0,"January 1, 2023",,,,,,,
9788076111226,2024-04-19 22:37:47,Gazely by Patrik Hartl,3.75,353.0,21.0,"October 13, 2023",,,,,,,
9788027909902,2024-04-19 22:37:50,"Probuzená šelma (Michal Dabert, #6) by František Niedl",4.0,2.0,0.0,"January 1, 2023",,,,,,,
9788024294124,2024-04-19 22:37:52,Římská jízda by Jan Drbohlav,2.5,2.0,1.0,"November 1, 2023",,,,,,,
9788075885142,2024-04-19 22:37:59,"Brutální béčkový masakr (Stará béčková legenda, #2) by Shigor Birdman",4.11,9.0,2.0,"September 18, 2023",,,,,,,
9788088488545,2024-04-19 22:38:01,Sto skořápek podruhé by Pavel Skořepa,4.33,3.0,2.0,"January 1, 2023",,,,,,,
9788074655999,2024-04-19 22:38:04,Voňavka by Robert Wudy,4.0,1.0,0.0,"January 1, 2023",,,,,,,
9788086814094,2024-04-19 22:38:09,Písně kosmické by Jan Neruda,3.73,243.0,9.0,"January 1, 1918",,,,,,,
9788072444977,2024-04-19 22:38:16,První král by Ludmila Vaňková,5.0,1.0,0.0,"January 1, 2023",,,,,,,
9788011034887,2024-04-19 22:38:21,Formulista by Michaela Schmiedlová,4.12,76.0,17.0,"September 18, 2023",,,,,,,
9788075304407,2024-04-19 22:38:26,Pozastavené stmívání by Stanislav Dvorský,4.0,3.0,1.0,"January 1, 2023",,,,,,,
9788076950283,2024-04-19 22:38:28,Paní na Svojanově: Láska pevnější než kámen by Jaroslava Černá,1.0,2.0,2.0,"January 1, 2023",,,,,,,
9788027724017,2024-04-19 22:38:33,Gump - Jsme dvojka by Filip Rožek,4.37,35.0,6.0,"January 1, 2023",,,,,,,
9788074565441,2024-04-19 22:38:36,"Bílá jako sůl (Poslední velkoměsto, #5) by Vladimír Šlechta",4.33,6.0,0.0,"September 1, 2023",,,,,,,
9788088482178,2024-04-19 22:38:39,"Orfee, by Dominik Melichar",5.0,1.0,0.0,"January 1, 2023",,,,,,,
9788024952291,2024-04-19 22:38:42,Věci mezi lidmi a byty by David Budai,5.0,1.0,1.0,"October 1, 2023",,,,,,,
9788074565489,2024-04-19 22:38:46,Necrobox by Petr Heteša,3.8,5.0,3.0,"September 1, 2023",,,,,,,
9788011033576,2024-04-19 22:38:48,Sedmá vražda by Miroslav Skačáni,0.0,0.0,0.0,"January 1, 2023",,,,,,,
9788027606566,2024-04-19 22:38:49,"Případ ambiciózního démona (Mýtoversum, #1) by Martina Eretová",4.0,8.0,3.0,"October 27, 2023",,,,,,,
9788027151981,2024-04-19 22:38:53,Četi nejsou by Zdeněk Svěrák,3.2,5.0,1.0,"October 18, 2023",,,,,,,
9788027130658,2024-04-19 22:38:56,Praha v proměnách času by Petr Sojka,4.0,1.0,0.0,"October 26, 2023",,,,,,,
9788011035594,2024-04-19 22:38:58,Ztracenné by Michelle Losekoot,4.17,144.0,23.0,"January 1, 2023",,,,,,,
9788027722976,2024-04-19 22:39:03,Prokletá Mimzie by Tess M. Puffrová,4.64,11.0,2.0,"November 25, 2023",,,,,,,
9788074763106,2024-04-19 22:39:07,1492: Dobytí Granady by Lukáš Zárybnický,4.67,3.0,1.0,"January 1, 2023",,,,,,,
9788072157099,2024-04-19 22:39:09,Knihy básní by Vladimíra Čerepková,4.0,2.0,0.0,"January 1, 2023",,,,,,,
9788088437147,2024-04-19 22:39:15,Velký průšvih by Anna Beatrix Bártová,4.0,2.0,0.0,"January 1, 2023",,,,,,,
9788088363385,2024-04-19 22:39:20,Gaslighter by Markéta Harasimová,3.0,1.0,0.0,"January 1, 2023",,,,,,,
9788088483618,2024-04-19 22:39:25,Rozcestí osudu by Emilly Ross,4.15,13.0,5.0,"January 1, 2023",,,,,,,
9788089550944,2024-04-19 22:39:29,Magus by Kamil Zbruž,1.0,1.0,0.0,"January 1, 2023",,,,,,,
9788088378365,2024-04-19 22:39:35,Strastiplná robotí existence by Taťána Rubášová,4.6,5.0,1.0,"October 1, 2023",,,,,,,
9788020721877,2024-04-19 22:39:39,"Tiše, aby nás neslyšel… by Ondřej Macura",4.67,3.0,0.0,"October 30, 2023",,,,,,,
9788088406679,2024-04-19 22:39:41,Hodina dějepichu by Jan Studnička,4.6,15.0,2.0,"January 1, 2023",,,,,,,
9788076661059,2024-04-19 22:39:46,Zefkovo probuzení aneb splíny (v) budoucnosti by Marek   Müller,3.0,2.0,1.0,"January 1, 2023",,,,,,,
9788090880542,2024-04-19 22:39:48,Příběhy z Orlických hor v komiksech by Radek Drahný,3.0,1.0,0.0,"January 1, 2023",,,,,,,
9788088411246,2024-04-19 22:39:49,Hella by Alena Machoninová,3.58,12.0,1.0,"January 1, 2023",,,,,,,
9788088467816,2024-04-19 22:39:52,Balada pro Emily by Jarmila Stráníková,3.8,15.0,4.0,"October 21, 2023",,,,,,,
9788025742532,2024-04-19 22:39:58,Můžu to doříct...?: Výběr z podcastů 2021-2022 by Jan Dobrovský,5.0,2.0,0.0,"November 3, 2023",,,,,,,
9788076950535,2024-04-19 22:40:01,Obchodníci s dětmi by Hana Hindráková,3.0,1.0,0.0,"January 1, 2023",,,,,,,
9788027150380,2024-04-19 22:40:04,Malé tečky světla by Zuzana Švédová,5.0,1.0,0.0,"November 20, 2023",,,,,,,
9788027139989,2024-04-19 22:40:07,Třicátý kilometr by Kateřina Dubská,2.8,5.0,1.0,"November 13, 2023",,,,,,,
